{
  "schemaVersion":"1.0",
  "profileId":"pdd-board-shoes",
  "categoryId":"201517965903",
  "verifiedAt":"2026-09-19",
  "executionEnabled":false,
  "fields":[
    {"internalKey":"mainImages","platformLabel":"商品轮播图","required":true,"control":"upload","status":"observed","notes":"页面显示1:1或3:4、宽高大于480px、单张小于3MB、最多10张"},
    {"internalKey":"auxiliaryImages","platformLabel":"商品辅助图","required":false,"control":"upload","status":"observed","notes":"页面说明用于搜索、推荐、频道和活动等多个流量场景"},
    {"internalKey":"title","platformLabel":"商品标题","required":true,"control":"input","status":"observed","notes":"页面提示最多30个汉字（60个字符）"},
    {"internalKey":"brand","platformLabel":"品牌","required":false,"control":"select","status":"observed","notes":"下拉选项尚未取证"},
    {"internalKey":"upperMaterial","platformLabel":"鞋面材质","required":false,"control":"select","status":"observed","notes":"页面标记重要；提示该材质必须占鞋面30%以上；选项待取证"},
    {"internalKey":"soleMaterial","platformLabel":"鞋底材质","required":false,"control":"select","status":"observed","notes":"页面标记重要；选项待取证"},
    {"internalKey":"applicableGender","platformLabel":"适用性别","required":false,"control":"select","status":"observed","notes":"页面标记重要；选项待取证"},
    {"internalKey":"closureType","platformLabel":"闭合方式","required":false,"control":"select","status":"observed"},
    {"internalKey":"upperHeight","platformLabel":"鞋帮高度","required":false,"control":"select","status":"observed"},
    {"internalKey":"ageRange","platformLabel":"适用年龄段","required":false,"control":"select","status":"observed"},
    {"internalKey":"season","platformLabel":"适用季节","required":false,"control":"select","status":"observed","notes":"页面标记重要；选项待取证"},
    {"internalKey":"listingSeason","platformLabel":"上市时节","required":false,"control":"select","status":"observed"},
    {"internalKey":"applicablePeople","platformLabel":"适用人群","required":false,"control":"select","status":"observed"},
    {"internalKey":"function","platformLabel":"功能","required":false,"control":"select","status":"observed"},
    {"internalKey":"style","platformLabel":"风格","required":false,"control":"select","status":"observed"},
    {"internalKey":"craft","platformLabel":"制作工艺","required":false,"control":"select","status":"observed"},
    {"internalKey":"fleece","platformLabel":"是否加绒","required":false,"control":"select","status":"observed"},
    {"internalKey":"productCode","platformLabel":"商品货号","required":false,"control":"input","status":"observed"},
    {"internalKey":"soleThickness","platformLabel":"鞋底厚度","required":false,"control":"input","status":"observed","notes":"单位cm"},
    {"internalKey":"model","platformLabel":"型号","required":false,"control":"input","status":"observed"},
    {"internalKey":"productName","platformLabel":"产品名称","required":false,"control":"input","status":"observed"},
    {"internalKey":"manufacturerName","platformLabel":"生产者（制造商）名称","required":false,"control":"input","status":"observed"},
    {"internalKey":"manufacturerAddress","platformLabel":"生产厂家地址","required":false,"control":"input","status":"observed"},
    {"internalKey":"certificationRequirements","platformLabel":"认证标准和技术要求","required":false,"control":"input","status":"observed"},
    {"internalKey":"warningDescription","platformLabel":"产品警示说明","required":false,"control":"input","status":"observed"},
    {"internalKey":"qualification","platformLabel":"商品资质","required":false,"control":"select","status":"observed","notes":"选项待取证"},
    {"internalKey":"packageLabelImage","platformLabel":"包装标签图","required":false,"control":"upload","status":"observed"},
    {"internalKey":"productVideo","platformLabel":"商品视频","required":false,"control":"upload","status":"observed","notes":"页面显示时长60秒以内，比例1:1、16:9或3:4"},
    {"internalKey":"detailVideo","platformLabel":"商品讲解视频","required":false,"control":"upload","status":"observed","notes":"页面显示时长10秒至5分钟，比例9:16"},
    {"internalKey":"detailPageVideo","platformLabel":"商详视频","required":false,"control":"upload","status":"observed","notes":"页面显示时长3分钟以内，比例16:9"},
    {"internalKey":"detailImages","platformLabel":"商品详情","required":false,"control":"upload","status":"observed","notes":"快捷编辑最多50张"},
    {"internalKey":"colorImages","platformLabel":"颜色规格预览图","required":false,"control":"upload","status":"observed","notes":"每个颜色行均有图片入口，生成规格矩阵后显示为预览图列"},
    {"internalKey":"sizeChart","platformLabel":"尺码表","required":false,"control":"table","status":"observed","notes":"平台推荐模板生成；已观察脚长(mm)、脚宽(mm)、区间值、排序、保存尺码表图片、同步添加至商品详情"},
    {"internalKey":"stock","platformLabel":"库存","required":true,"control":"table","status":"observed"},
    {"internalKey":"groupPrice","platformLabel":"拼单价(元)","required":true,"control":"table","status":"observed"},
    {"internalKey":"singlePrice","platformLabel":"单买价(元)","required":true,"control":"table","status":"observed"},
    {"internalKey":"merchantSku","platformLabel":"规格编码","required":false,"control":"table","status":"observed"},
    {"internalKey":"referencePrice","platformLabel":"商品参考价","required":true,"control":"input","status":"observed","notes":"页面提示应大于商品最大单买价"},
    {"internalKey":"discount","platformLabel":"满件折扣","required":true,"control":"input","status":"observed","notes":"当前显示满2件9.5折"},
    {"internalKey":"shippingPromise","platformLabel":"承诺发货时间","required":true,"control":"select","status":"observed","notes":"已观察48小时、24小时、当日发货及揽收"},
    {"internalKey":"services","platformLabel":"更多服务","required":false,"control":"checkbox","status":"observed","notes":"已观察普通商品、非二手、非定制、非预售、新疆西藏收费默认模板、2人拼单；展开修改内容待取证"}
  ],
  "variantDimensions":[
    {"internalKey":"color","platformLabel":"颜色分类","status":"observed","options":["白色","米白色","乳白色","象牙白","深灰色","浅灰色","奶奶灰","灰色","银色","铅色","石板灰","银灰色","深空灰","石墨色","黑色","桔红色","玫红色","粉红色","桃色"]},
    {"internalKey":"size","platformLabel":"童鞋尺码","status":"observed","options":["欧码","英码","通用","自定义童鞋尺码"]}
  ],
  "evidence":[
    {"kind":"screenshot","reference":"2026-09-19 用户提供：童鞋板鞋基础信息与属性全页","redacted":true},
    {"kind":"screenshot","reference":"2026-09-19 用户提供：颜色分类多选弹窗","redacted":true},
    {"kind":"screenshot","reference":"2026-09-19 用户提供：欧码16至42及半码选项","redacted":true},
    {"kind":"screenshot","reference":"2026-09-19 用户提供：英码、脚长脚宽尺码表及颜色×尺码SKU表","redacted":true}
  ]
}
